Reviews,Rating
"I am a keen fitness person both teaching fitness and doing my own personal training. This has all the functions I need. I love the detail of the watch and the app is brilliant. The watch makes me get up and move which is great as I have a desk job and suffer with my back if I sit too long. It is motivational, great functionality, everything I need.",5.0
"Useful services are hidden behind paywalls and subscriptions. The software is a bit buggy and requires hard resets from time to time. Whatsapp messages don't work with Iphone. I have since bought the Apple Watch series 5 and it is so much better, worth every penny. Do yourself a favour and spend the extra money on an Apple watch. It is better in almost every way.",3.0
I absolutely love my Fitbit. I can go 4 days without charging it and it is super fast to charge. I use it for everything all day everyday and it’s so helpful when it comes to workouts. It’s very motivational too and when you put your goals in it will continue to hound you to get up and move if you want to lose weight or be more active. I couldn’t be without it anymore - I genuinely love it and for the price I paid its so worth it!! 10/10 for me,5.0
"love this, great battery life 4/5 days... i wear mine everyday - not always to bed as it doesnt feel that comfy. it tracks my running when i forget to switch it to running mode, only problem ive had is sincing the fitbit to strava app. when i record on strava it syncs to fitbit but not the other way around which is very annoying. i also find that when i use the strava app - when it syncs after my run my steps can sometimes go down... sometimes upto 1/2000 which is odd.but i think i might need to get it looked at. anyway great buy and super happy with it",4.0
"Upgraded from a Fitbit blaze, didn’t realise how they have come on since I had my blaze. Clear screen with option for large clock display, works with Alexa . Do just a tiny bit miss the buttons on the side to turn the volume up and down when listening to headphone but looks better and overall feels like a worthwhile upgrade from the blaze if you have want a newer one",5.0
"I upgraded from an Alta HR to this one. I’m happy with it but the most annoying thing for me is that you can’t download music onto the watch. You can control playback of music via the watch which is still handy in the gym but you need phone nearby which is not so much.You also can’t use the payment function (like Apple Pay) unless you have a Santander account or one of the obscure banks listed. But that’s not an issue for most people because if you have Apple Pay, you’re just as likely to have your phone with you as your watch.",4.0
"This is a nice little watch, which shows clear and simple information. The sleep tracker is excellent which has prompted me to get Fitbit premium! I use the ‘always on’ display and it usually uses 15% - 20% battery per day. It’s really comfortable and very lightweight. I have only used the ‘walk’ exercise tracker but it is really good. I will be using the hike tracker when my fitness improves, then I will use the running tracker. The only downfall is that you have to bring your phone with you when you’re out tracking your exercises but I do hear they will bringing out a Versa with built in GPS! All in all a nice little watch and looks very trendy too!",4.0
"Bought this from Amazon in December. I've been back and forth in contact with Fitbit as it doesn't sync properly and have NEVER sent notifications of messages from texts or WhatsApp - they said it was a known issue they were working on but gave me no ETA. They persisted on closing the support ticket despite the Fitbit not working as advertised.Now, 5 months later - theyre since blaming it on my Android version despite always being told it was a big they'd worked on. Now I can't get a refund.I'm so annoyed considering I paid £169.99.If you're on Android or expect the manufacturer to follow up with support issues - don't bother.",1.0
"I bought this to replace an older version and love the big face and how easy it is to read the screen, took me a while to work it all out but absolutely love it and would recommend.Nice big charger included and extra strap part to fit larger wrists.Had toyed with getting iwatch but as a tracker you cant beat the Fitbit.",5.0
"Love my new versa 2 fitbit, I used to have the fitbit Inspire but decided to upgrade to the versa, it was easy to set up and the battery life is really good and I like the size of the face and the ease of use, it also has more exercise functions which I like, all in all I am very pleased with my purchase and would definitely recommend",5.0
Bought as a gift and I get updates on how brilliant it is all the time. Sleeplessness is a problem and the watch is encouraging relaxation and making improvements on a night's sleep.And then there is all the other fitness stuff that works well.Currently playing with the Alexa app and ear buds and enjoying what it can do.,5.0
"After purchasing the Versa 2 over the Versa lite I was disappointed to find that most of the features in the Versa 2 are not compatible with my own accounts/devices.To use Spotify you need a premium account, to download music you need use of Mac or PC (I have chrome book) You can use fitbit pay in UK as the banks listed if never heard of and does  it include any of the main UK banking retailers. None of these caviats to the use of the fitbit are advertised clearly enough for me to have realised before I purchasedSupport from Fitbit comprises of them sending links to troubleshooting articles, of which I'd already read before asking for support and did not answer my questions.I have had to delete and re- download the app several times just in order for it link and log into certain apps.I feel the step count in in accurate as I wake up and it's logs over 100 steps.",2.0
"The watch itself seems ok. But the GolfApp does not work, tried it twice and just doesn’t do anything. It finds my course but that’s it!!..... UPDATE... golf app just does not work reliably. It freezes, doesn’t Always hole advance, and the App developer Never responds....Real shame.",1.0
"I was really excited about this product and then I wore it for 3 days and I was extremely disappointed. It has now been over a month and I literally hate it. The bpm is off, we have a bpm machine at home and I’ve tested it against that and the Apple Watch and the Fitbit is ALWAYS wrong. The sleeping pattern NEVER measures, I wear it every night fully charged and it just doesn’t measure anything. Non of the wallets work because it only works in the US. (I’m from the UK). Also the motion sensor doesn’t work so you have to flick your wrist three times to then actually click the button (yes I have checked the settings are correct) just to see the time. This product just annoys me and I can’t return it because the box got lost in Christmas packaging. I wish I’d have spent a little more for an Apple Watch.",1.0
"I bought this as a gift to my wife after trying Fitbit inspire band didn't fit her wrist. It looks so cool and stylish, my wife really happy with it.There is nothing wrong with the app and tracking information the watch providing compared to most smartwatch. But compared to my Garmin watch it's definitely not on the same level of details and accuracy but considering it's half the price too I'm happy wth it.",5.0
I love my Fitbit Versa 2. It was an upgrade from the charge 2.The strap is a beautiful colour.It’s very modern and I get lots of compliments on this watch.It does everything I need it to do,5.0
"It is a cool watch but there are to many things that are not working.Connection is not working at all, and without that you don't receive notification, it doesn't track your sleep, can't see the weather on the watch. You can't pay with without the connection, the App is not sincronize how it supposed to.Basically it's a normal fitness tracker (steps,floors, kilometres,calories, heart rate and exercise)Those are the only thing that are working.But at this point you can spend less money for the same service.It's not only this one I've got now, I've change 3 (bought, refund or changed) cause they all had problems. At the end I kept this last one as a normal fitness tracker cause I was so fed up.",1.0
"I love this especially when it e-mails me when its battery gets low. I only carry my phone and wear this watch when away from home, so the battery prompt is very useful. I will probably buy a different strap despite this coming with a small strap and a large strap. I have a small wrist and the small strap works but I prefer a softer strap material.",5.0
Great product. Wish I had bought this first instead of buying cheap versions. Connects great to my Samsung mobile and it is very user friendly. Battery life is great too considering how much I use it. The colour has not faded in the strap either.Would recommend buying a screen protector for it.,5.0
"The battery life is rubbish. Since having my fitbit (1 seek) I’ve had to charge to it 3 times. It doesn’t last the 4+ days it says it does. Also, you only get 2/3 workouts meaning to get full use of the coach app you have to pay for a monthly subscription of £7.99 on top of the £200 for the Fitbit itself - very cheeky and money grabbing!!",2.0
"The watch seems decent in terms of performance however, the fitbit app is a nightmare, half the time you need to use the desktop to set up things like music. The desktop version then guides you back to using the mobile app which does not work.I could go into depth about how setting up this watch has nearly given me several brain haemorrhages but I'll save you the rant. I'd recommend spending a little more and getting a different product where the app isn't detrimental to the setup and operation of your smart watch. Would not purchase again.",3.0
"I've upgraded from Inspire to Versa2, but I will return it.I've been using it from one week now and I noticed that my burnt calories are way too high than it should be. For the amount of money we spend on these devices, we expect quality. Smart watch functionalities are useless, the mobile app is a joke.I will move to another brand. Very disappointed.",2.0
"bought for the wife mainly for the SPo2 function as advertised-it even says it on the box, but alas there is no option on the watch or app to show SPo2.. Trying to download clockfaces, any of them, but also the SP02 one, from the app is like pulling teeth-update : before clockfaces or anything works, it seems to need a few days to settle in on your phone app, your watch firmmware then updates at somepoint and apps and clockfaces will then download ok from the store... they really should put a warning for this, as such i've updated the review and star rating as it now seems to work as intended..",4.0
"Bought as a gift for my wife. Shes over the moon with it. Slight connectivity issues to begin but these were sorted with alittle internet troubleshooting.Works well, impeccable battery. Its been 3 days since first charge and it reads 50% still. I'm very happy that shes very happy with this purchase.HIGHLY RECOMMENDED!!",5.0
I have had problems with this from day one. There was issues with syncing the watch and eventually it seemed to work. Then every single day it had trouble syncing. Sent the watch away and they sent a replacement or a fixed one.. not sure which. Now I cannot receive any notifications and the syncing problem is still there. Don’t waste your money,5.0
"So far better than the Charge 2 I previously had. Strap colour is more purple than the picture which seemed more burgundy to my eye. Compliments the rose trim though.Good for a fitness tracker but some ""smart watch"" features are useless - payments for example you have to have a specific bank to use.Unclear how accurate the calories/steps are as I have nothing to compare it to but overall pleased with the purchase.",5.0
"I have had fitbits before and loved them but this one is great the display is so clear and easy to use, the only thing I don't use is that pay app as it doesn't have my bank on it so thats a bit annoying but thats the only thing I can say thats bad about it. I dont use the sleep tracker as I don't sleep with it on and I charge it every 3days or so",5.0
"Love this watch having had a Withings health mate watch, this feels good quality, especially the strap, so soft. The watch face is sharp and the screen colours are vivid. Activities tracked with 7 accessed easily from icons in the fit section. 1000s of clock faces. Alexa assistant at the push of the big button. Tracks sleep heart rate and the app is brilliant. Highly recommended",5.0
"I'm converted! As someone rather old school who has an obsession with watches, I had made a promise to myself to never get a smart watch. But hats off to FitBit, I'm fully on board now. The watch itself looks great. Very modern and sleek - I did buy a replacement strap out of personal preference but the one it came with it fine. There are lots of free customisable options for the clock face, plenty of settings and the software seems smooth. The sleep tracker has proven to be very accurate and it's ideal for day-to-day wear as well as when working out.",5.0
"Counted steps like mad, I did all the steps to reduce the sensitivity as per guides but it still was counting steps even before I got out of bed, while siting etc and then over counting calories I’ve burned because of it - rubbish, returned it!",1.0
"Bought this for my wife. The Product was rubbish, the set was too complicated and not user friendly.Hence returned it back, but unfortunately had to pay postage charges for a dull product.Hence, after this experience, very unlikely to but a Fitbit product from Amazon again.",1.0
"The band on this watch is far too uncomfortable, integration with other apps was inconsistent which was part of the reason for purchasing. Syncing with the Fitbit app was also too unreliable. Returned for a refund",1.0
"I am a techy coder and rarely have trouble with electronic devices. Everything about this watch has been a painful experience. Despite multiple factory resets, turning both phone and watch off and on again repeatedly, trying to connect to an android device has failed. This stuff should be simple by now. After three days have still not been able to even get the watch to update its firmware properly.After doing much searching, found that despite my Huawei P8 Lite meeting all the specifications for this product and software, there are still workarounds needed. The work around instructions provided by Fitbit for my phone bear no resemblance to the menus available on my phone.Clearly a poorly conceived and poorly tested product.",1.0
"I decided on this watch after some careful consideration, I have only had the Versa 2 since January 2021 and already the battery doesn’t last any longer than two and a half days??? It is supposed to guarantee four days?? It feels like the watch has been on charge longer than on my wrist",2.0
"I love this product, it’s my 3rd Fitbit. The only issue I’ve had so far, along with other people after reading comments, is that I can’t connect my device to the internet. I tried a couple of times and gave it up as a bad job.Otherwise I really like the watch, the screen seems quite resistant, the added features are good (Alexa and Spotify app). I would recommend",4.0
This is a welcome improvement on my previous versa.  The display is simpler to use and retains the same monitoring as before.  Being Fitbit I still have access to all my historic data which this Versa 2 is appending to the existing data.  Shame they still haven't added GPS to it's functionality - oh well.  Maybe in the next incarnation.,5.0
"Bought it for a releative, great little device and has lot of functions, alexa built into it and tracks steps walked, calories burned and other things which i unfortunately cant remember but are really useful. includes a charger for the watch. Great item and came brand new.",5.0
"Like everything about this smart watch. Have had the previous model to this one. But this is a brilliant upgrade. Easier to use via the touchscreen, longer battery life, I recharge it every 4 days. Also works with Alexa which is useful.Well pleased with my purchase.",5.0
"For all it’s shortcomings this watch does do what it says on the tin. Great at tracking steps, workouts, runs and giving you a rough idea of calories burned through exercise. However, I have now gone through 3 of these watches in less than a year. The only reason I have continued to use it is because FitBit have replaced my broken or faulty watch each time, otherwise I would have moved to a competitor much sooner. FitBit have been great whenever I’ve had an issue, but if you want something that’ll be durable and last a couple of years then this isn’t the watch for you. I will be moving to a competitor when FitBit stop replacing my watch each time it breaks.",3.0
"Husband got this after I got my charge 3 because he just has to be more fancier than me. He loves it, although the NFC pay function isn't great at all, the bus didn't register it and neither did the barriers at the tube station. Other than that, it's a great smart watch.",5.0
"I'm really disappointed with this smartwatch, as a watch I love it, it's beautiful.  However, as a fitness tracker it is not tracking anywhere near accurately at all...if I run 3.1 miles it thinks I've ran 2.3-2.5 miles, even when I connect to phone GPS.  I would return this but already binned the packaging :-(",2.0
The fitbit is great. Lots of watch faces you can download in the app. Lots of features you can use. I like the fact you can connect headphones and listen to music but was disappointed I cant listen to my amazon music through Alexa on the watch. You have to have deezer or spotify.,5.0
Easy to use and set up. Tracks activities sleep accurately. Notifications work well... Just wish u could load goggle pay onto it rather then it's own pay app.,4.0
"Had the device for a matter of hours. So far, unimpressed. It won't detect my heart rate. You can't change the clock from 12hr to 24hr through the app, have to go to the website, which doesn't work. Now i remember why I went to Garmin 2 years ago. And still the same issues 2 years on. Preparing to return",1.0
"Bought 2  Fitbit watches a Fitbit versa 2 for my wife and charge 3 for myself, 8 months later both had screen issues ... not buying another Fitbit ever. Extremely disappointed, a cheap fitness watch would have lasted longer.Fitbit Improve your reliability or otherwise no one will buy these watches again.",1.0
"It’s got me moving so much more,, I had a cheap version, that seemed to take forever to teach 10000 stepsI really had to flog myself to get there.Put my Fitbit on took my dog out Did our usual route, that on my old one would say I’d walked around 2600 steps.On my Fitbit I’d done 5300 on our first walk. No wonder I was so tired at end of day. On my Fitbit now I’m averaging around 17/18000 steps a day .",5.0
"I love all of the features however was very disappointed to learn it does not allow me to see my text as the Samsung A70 doesn't work with it (only their own fit watch) very disappointed as my Samsung J3 did, I  didn't know until I had worn it for  a few days.",5.0
"Very happy with it. Battery a bit disappointing at 2 1/2 - 3 days. Don’t really use sleep tracking but it seems to be working fine, great for tracking exercise as well as steps. Music can link Spotify but not Amazon (surprising given it has Alexa) and for music with no phone the actual MP3 files need to be loaded from a computer.Heart rate monitor is good and the fat burn zone minute function is very useful.",5.0
"I’ve had 4 versa’s now, all broken. 1st one the screen went after a few months and I received a replacement. The screen popped out of that one when I was swimming. It’s was about 18 months old so I bought this one in February. In September I had battery issues and was sent a replacement. The replacement is faulty, the screen doesn’t scroll. I’ll be trying to get a full refund and will go with a different brand.",1.0
"Charge lasts around 4 days, Apps are good though one key feature missing that i think should be free is sleeping heart rate and not as part of premium monthly payment. Heart rate, Fitness and sleep tracking are all great. Nice big easy to read and use screen.",5.0
"A bit useless when it comes to HIIT workouts but quite good for running. The minute you move your wrist slightly or sweat it loses your HR and is almost impossible to get back. Good as a step tracker, running watch, although not always accurate with mileage. Battery life is fab - 3-5 days normally.",3.0
"While the watch is great and performs perfectly, the same cannot be said for the strap provided. Already the bit to put the strap through has snapped ( same thing happened with my old versa) and strangely it has a spare half strap provided but no spare strap holder.",4.0
If u want to listen to music you need to subscribe to Spotify or deeper. More accurate than charge 3. Trying the 7day premium. The wellness section is really good. Watch dues not feel too heavy. Bought when discount was on and bough a woven strap separately. Can't wear the plastic causes irritation/heat,5.0
"I've had mine around 4 months now and overall it's pretty good. It tracks steps and activity well, battery lasts about 5 or 6 days before needing to recharge and it recharges very quickly.One downfall I would say is the connectivity. I have set mine up to notify me of calls & messages and the ""find phone"" feature. However, sometimes the watch isn't fully paired with my phone and so I miss notifications or ""can't find my phone"". When this happens I'll either need to go into the app to resync the watch or I'll need to turn off and on the watch/phone altogether.",4.0
"Great, had a Fitbit blaze and it lasted a long time but the charge didn’t last long enough anymore so felt it was time for a new one. This is more accurate than the blaze; just knocking my arm will not add steps like it would’ve done with the blaze. Happy customer",5.0
The watch works well but has issues. GPS doesn't work most of the time and when it does it cuts out a lot. The LED that reads your heart rate broke after 3 months and that was one of the main features I brought it for. Steps counting varies as far as 5000 steps even if I do the same thing each day. When scrolling through the apps on the watch it lags. It sometimes has issues connecting through Bluetooth to the phone app. The wallet app only works with unknown banks e.g not mainstream ones.,3.0
"Great piece of kit but totally speechless about how utterly useless the charger is. It would be better with a normal mini USB but you have to clip it in to this ""thing"" which doesn't stand properly - difficult to explain but you'll soon see what I mean!!",2.0
Adore my new fitbit. My fiancé got it for me for Christmas and I couldn't be happier with it. Great battery life and I love the fact that it can be customised with colourful clock faces. Does everything from sleep tracking to blood oxygen levels. We'll pleased with it.,5.0
"I am happy with this watch, and it is good value, although I have a few niggles, although I am not sure whether the problem lies with the watch or with the phone. Some notifications do not come through to the watch although the necessary permissions seem to be given. Although I have set it to be displaying the time all day, the battery lasts well.",4.0
"I love the colours of this one, had it around a year now and still love it. Just dislike how fast the batteries go down on products like this, tried a few different brands and all seem to be the same. App and watch work well, no complaints as yet",5.0
"This is a good watch and the Fitbit app gives a really good overview. But the problem is that it estimates too much rather than giving actual data. So without wearing the watch you’ve already burnt 700 calories, because it determines according to your heart rate, which stays the same as the last time you wore it. It’s a good piece of kit, but if you want really accurate results, it’s flawed.",4.0
"Absolutley rubbish delivery....driver left this and a number of other items on my doorstep in full view of a busy road!! This item is nearly £200!I even have ""leave with a neighbour"" on my delivery info.... very angry! Something needs to be done about this!",1.0
"This fitness tracker will only work/sync up with some models of phone/operating systems. It failed to collect to my phone, nor my Windows 10 PC. I got on to technical support and they confirmed that this is an ongoing, unresolved issue as the Versa 2 is not compatible with many makes of phone.Buy with care (or don't buy at all)!",1.0
Love this! I wear it all the time and really love checking the app at the end of the day to see my progression. Only downside is the sleep tracker isn't 100% accurate- it's good but it isn't as sensitive as I'd like. Still love it and would recommend.,5.0
"I absolutely love my watch. I have a heart problem and it is pretty accurate in recording my heart rate.Steps are not always that accurate as chopping veg and stirring food in a saucepan seems to clock up steps, but most watches I have had also have the same problem.It is easy to use and I would recommend",5.0
"My deezer doesn't  sync probably. I cannot comment about the sleep tracking as I do not sleep with it. It looks  good, but I am probably not using all of the functions, the function I want to be working I.e the music function has not worked properly despite contacting Fit Bit directly",3.0
