Reviews,Rating
Best avoid this model. Its super time consuming and complicated to use. The battery life is dire.Possibly the worst purchase I've ever made.,1.0
This was a present bought for me to replace my old fitbit. I love the clear face and features. This Fitbit has just about every type of exercise you could need plus other useful apps.,5.0
First one only lasted a month . Amazon changed it no bother. See how long this one lasts,5.0
"Great item easy to use, comfortable to wear and does everything it is meant to do!",5.0
"It seemed to work fine for a few weeks but ive had nothing but problems with it since. It won't track or save workouts on the watch or on the app, it doesn't track sleep properly, it doesn't sync properly and kicks me off the app a lot too. Very unhappy with it waste of money it doesn't do anything it's supposed to",1.0
Only really use it for steps and checking my messsges...absolutely love it,5.0
"Great Fitbit comes with so much relax, workout, pay from your Fitbit, Alexa, you can change your watch face and so much more.",5.0
I love this watch the strap is soft and the watch face is clear and bright,5.0
Nice looking. Bit more feminine looking than the Ionic. Does a decent job of tracking steps and distance,5.0
Do not buy if you are heavily tattooed. This watch will not track your heart rate or sleep if you are heavily tattooed. The customer service advice was wear it on your ankle. Yes so I can look like I’m on tag.... no.,1.0
Wife loves as she can now keep an eye on what she is doing to keep fit.,5.0
Very light weight and simple to use. Not had it long but impressed so far. Shame it’s not full smart watch so you can’t answer calls and send messages but everything else seems to work well.,5.0
Really good Fitbit - logs sleep and exercise well. Great apps on watch. Good battery life.,5.0
"The software on this watch is VERY VERY glitchy and hard to use.I had a Fitbit Charge 2 which finally broke after 2 years of being battered and bought this as what I thought was an upgrade. Sadly not.Stay simple and just get another charge 2, I wish I had",1.0
Great for helping me get on track with my health and fitness. The colour is lovely too.,5.0
Very good value for money and just the perfect gift for my wife who loves it and would recommend and is easy to use and set up.,5.0
Very good product. Not sure about accuracy as tracks weightlifting reps as steps..,4.0
"My wife loves this smart fitness tracker/watch for many, many reasons, but here is just a sample;1) Large display.2) Very easy to operate.3) Informative.4) It’s stylish and colourful.",5.0
Bought for my Mum she loves it and is now obsessed with all the apps,5.0
Great when it works. Not so great when it malfunctions mid-run and you lose all of your sweet Strava data. I bought this in January and by July it’s already unusable. Buy a Garmin!,2.0
"Bought as a presant ,but was told it is really good fitness watch.",5.0
Bought as a replacement product. Does exactly what is say. Very smart product. Looks like the other more expensive product but at a fraction of the cost and has many similar features. Excellent product.,5.0
"It has taken my husband a little while to get used it this, he used to have a Fitbit surge. Seems to like it though.",5.0
"Brilliant item. Doing million step challenge for diabetes UK & my versa 2 had kept me going, reminding me when need to do more steps etc. The sleep mode has helped me with get my sleep pattern better",5.0
Brought this for my son as a Christmas giftHe finds it does all what he needs it too,5.0
Purchased as a gift but the recipient loved everything about it.,5.0
"My third watch Fitbit ,response quicker than the Fitbit versa,easier to use, one button instead of 3",5.0
"No longer at the gym but this keeps me motivated - logs my 10,000 steps each day, diet, water and weight as well as quality of sleep.  Just a nudge in the right direction every day along with Joe Wicks.  I also love the colour and graphics.",5.0
Great item. Bought for my sister.. only thing is that it scratches quite easy compared to the versa 1 which I have.Lots of features handyA great item,4.0
"2 fitbits in, my heart rate is still around 50bpm off.I do vigorous exercise and my chest monitor records 160bpm, whereas this one shows 100-110. It's only good for step tracking but to be honest a £20 smart watch can do that.Utterly useless, avoid at all costs.",1.0
"Would not recommend this product. Bought it for my wife and less than twelve months later it's packed up! All that's displayed is the Fitbit startup logo on the face. Having checked online for a solution, it would appear that this is one of a few problems with this product.  Avoid!!!!!",1.0
"Good value if bought at reduced price.  Better than my previous Versa Lite, if only because of improved battery life.  Would be even better if extras were provided free.",5.0
"Doesn't connect to p30. Spoke to fit bit who are aware of the issue... Told last November they were “working on it ""Waste of time as majority relies on phone connection!!!!",2.0
Really good quality!!!! Would recommend... fantastic price....,5.0
"I was reluctant on buying this as I already had a cheap version, family persuaded me to and I honestly love it!! Excellent buy",5.0
"This is so good looking, comfortable and a fantastic bit of kit so glad I chose it. Very very happy",5.0
Bought this to my mother for Christmas and she loves the watch. It really has many things to offer.,5.0
Sorry but this no longer works I would like a refund please,1.0
"Bought for my sons birthday, and we're big Fitbit fans. Wife and I both have them, and now my son does too.",5.0
Nice looking watch with good features but the biggest let down for me is the distance when not tracking through GPS. The whole point of me getting a watch to track my running was so I didn't need to bring my phone but I need to bring my phone with me or else the GPS distance and my pace will be completely off.,2.0
Quick Delivery... was bought as a gift and my partner loves it!!,5.0
"The battery needs charging every 2 to 3 days, pain in the bum, but love the watch itself",5.0
Really liked the watch but it's Bluetooth is useless. Won't update on the app with my phone and have had to delete it 3 times in a month meaning it wipes my data. Worse connectivity than my old blaze. Sadly I think I will have to return this and not sure I will get a replacement.,2.0
I've had the fitbit versa 2 for less than a month and it has completely died. It turned off with a 70% battery and hasn't turned on since. I have followed all troubleshooting guidance to no avail. After looking online it appears a number of people have had the same issue. Avoid.,1.0
"Does what it's meant to do, set up is a bit complex, can't link emails to it yet but getting there bit at time",5.0
"A good upgrade from my Fitbit blaze. Sadly I can't use fitbit pay for my bank as in the UK, it doesnt' support more than a couple of banks.",5.0
"Really like the display options and all of the apps. Also find the step counter really accurate. After just two days of wear however, the silicone strap is already really irritating my skin making it quite red and itchy. I’ve ordered a replacement strap which will hopefully solve the problem",3.0
This is brilliant better does everything it says,4.0
"Pretty impressed so far, battery life is good (circa 7days), easy to navigate etc",5.0
"Great tracker, good price, delivery and service",5.0
"Watch looks fantastic. No problems setting it up, or syncing the watch to my phone. Great purchase that i would recommend to anyone.",5.0
great features and looks really good.Best used with Android to get the most out of it,4.0
Just does efficiently what it says it would do,5.0
"Dear Sir/Madam,I have recently purchased a Fitbit Versa 2 from you (22nd January 2021) and I’m disappointed to say that the device has stopped working already. The watch has been fully charged and it does not turn on. For a brand new device to stop working after 3 month is frankly shocking.",1.0
Lovely watch and great for keeping track of sleep and heart rate,5.0
The only shortcoming is that the strap appears to have been assembled incorrectly and therefore appears to be inside out.,5.0
I didn’t like the button on the left of  the  Fitbit and could do with some different free watchfacesI like the  apps and  let you know how many steps left at the hour to achieve your goalsI like the shape of the watche,3.0
"I love this, I love the way it looks, I can keep track of my activity and sleep - or lack of.  Bit annoying I can’t use to reply to messages as I have an iPhone. I have had to reset it a couple of times but it seems to be a common thing.",5.0
Brought as a present. They are happy with it,4.0
I use it for fitness tracking steps walking.,5.0
Battery is shocking has 60 % this morning now completely gone not touched it,2.0
Brought this back in December and found it was not easy to set up and Pair to headphone and isnt very good value for money as today the screen has just gone completely blank and won't come back on and it's now out of return for the money I paid would expect a longer return time,1.0
"Easy to set up, accurate, excellent watch++++",5.0
Absolutely fab watch! I bought one for my husband and ended up buying one for myself a few days later! This has resulted in us being a bit competitive but it’s added to the fun,5.0
"Good all rounder, value for money and has everything you need for exercise and healthy living.",5.0
Had to return the first one as kept unexpectedly shutting down. No hassle return and replace. New one working fine,5.0
"Bought as a gift, all seems to be well so far! Looks great, works well with app. No problems at all.",5.0
"Nice fit on wrist, happy with how it works with app.Easy to set up.",5.0
Great product would recommend just love my new watch,5.0
Sometimes it does not link to my watch Whitchurch is very infuriating ☹️,5.0
Product information was very poor that came in the box. I had to google to understand how to operate! Today (2 weeks later) the strap has just broken completely on me ....not happy,1.0
"Brilliant, do what I want track my workouts is just perfect! I love while I am on my desk working and I receive messages and calls.",4.0
Only thing I not happy with is the CHARGER BASE doesn't sit flat needs to be designed alot better sooner rather than later.,4.0
Not happy at the condition it arrived in.,4.0
"Simple, easy to use. Big battery drain when using anything that needs the phone app open eg Alexa! Good tracking during exercise.",5.0
Bought for my sons birthday and he loves it.,5.0
bought for the wife who thinks it is great..,5.0
I bought this for Granddaughter and she is very happy with it.,5.0
So happy I bought this item. Came down super fast after ordering. Loving it so far.,5.0
"Love this watch, easy to use and great step counter. I had a Samsung galaxy watch before and it was huge on my wrist and heavy, this Alta is much smaller and dainty and fits my wrist much better",5.0
"This piece of crap records steps if youre sitting still. Waste of time, avoid",1.0
"I love this. Completely life changing, so simple and easy to use. My only issue was that I had a bad skin reaction to the strap - but easily managed to buy a replacement fabric strap and now have no issues",5.0
Gives great accurate results for Sleep pattern and is great for monitoring step count and general health...,5.0
"My second fitbit, I’ve had it since Christmas & now it’s stopped working, have been told by Amazon that I need more up to date iphone.",5.0
Only worked for three weeks after purchase and lost all battery power within minutes of charging then froze and never switched back on.,1.0
Love it always had a Fitbit but love this one,5.0
"Great and easy to use, looks good too",5.0
"Great watch, stylish, functional, better value than the Apple. Does everything you need it to do - very well",5.0
I bought it for my wife.  Seems to work very well.,5.0
Arrived on time and great product.,5.0
Found the  watch very good had fitbit before but this beats the others,5.0
Bought this to upgrade from Versa 1 and quite impressed so far especially with the Alexa voice control.,5.0
Good for keeping track of your exercise and sleep.  Looks good. Now I have to work out how to get music through it.,5.0
Love this fitness tracker.Best from all of my watches.Looks really good and very accurate.,5.0
"I bought this Fitbit Versa 2 and I love it! I love tracking my steps, heart rate and sleep which this product allows me to do and it is so accurate!The app that the data all goes onto is easy to use.A great purchase, would 100% recommend.",5.0
Very good Fitbit for tracking most exercise does all I need for me,5.0
"Straight out of the box, doesn't even charge. Every step followed correctly and nothing on the screen, doesn't show charge or doesn't turn on.",1.0
Bought this as a Birthday present works really well with Huawei P10 (android) phone,5.0
No better than my previous Blaze,4.0
Display is better than my charge. Like the health metrics update.,4.0
"Have Just received this Fit bit, however I have had it on charge for a full 24hrs and is still not fully charged, it's just stayed at the same point. VERY DISAPPOINTED.",1.0
Doesnt like huawei phones so won't keep a constant track but the watch is brilliant,5.0
I would have rated it high if it hadn't of packed up after less than four months of ownership.  The battery life could be better as my charge 3 lasted a week.,1.0
Love this!!! Went for a cheaper option first but it was rubbish. This is great at tracking sleep and training. Has lots of added extras. Would definitely recommend!,5.0
"I had my fitbit sent for repair through amazon and since ive had it back its been glitching, not charging properly and has not completely switched off. I originally had a rose gold which they replaced with a black one and im so annoyed as i use my fitbit constantly. Not happy.",1.0
"I went for the Versa2 because of the 5 day battery life feature, but I am lucky to get 2/3 days of charge which is really annoying, since this is the main feature of going for the original versa vs versa2, I am not sure it is worth the extra money.",2.0
"Don't bother with cheap versions, this is the best by far. App very good, notifications excellent, does deliver all it promises.",5.0
Nice unit overall but could be so much better for the money. Alexa loses connection and doesn't work 90% of the time. Does hold its charge for 5 days though. I've had 2 of these replaced and am already on my third due to unfixable software issues. Notifications work well.,4.0
"Love versa 2, helped with tracking ""walk all over cancer""",5.0
Very happy with the product,5.0
Dissappointed in the inaccuracy of swimming lengths counted.... ave 15% MISSING .,4.0
"Bought for wife as an upgrade of the charge 2. She says it's great, good battery, charges fast, keeps track of everything. The colour face is really nice. It also has lots of apps for things like the weather and games. Great buy!",5.0
A present for my Husband and he is happy with the Fitbit Versa 2.,5.0
"Danger....you will become addicted and always trying to beat previous scores.I’m knackered,",5.0
Just I wanted. Can see the time and having the prompt to move again. Day 2 in liking it.,5.0
Great little piece of kit,5.0
Really disappointed that they have changed active minutes for zone minutes. Very badly thought out change. This is my third Fitbit and the watch itself is great but I won’t be having another unless the zone minutes are thrown in the bin where they belong.,2.0
Present not given yet,5.0
Always wanted one not disappointed! Brilliant watch/ Fitbit,5.0
Bought as a gift and they love it.,5.0
Purchased for a gift,5.0
The charge isnt very good some state holds 5 days hut mine holds 3-4,3.0
Everything satisfactory,5.0
Didn't sync well with my huawei phone and so returned,3.0
"only problem with is synchronization time sometimes , 4*",5.0
"Ease of use, battery life and fitness tracking, are superb, plus it looks good to.",5.0
I love this watch and it has a wonderful design and it looks very nice and it does what is meant to I am reviewing my sleeping patterns and exercise and i can play my music and so on,5.0
"I love it, does exactly what I want it to do ie get me moving! Sleep tracking is fascinating. Battery life fab, 4 or 5 days. Would definitely recommend",5.0
Alexa worked for a couple of weeks then decided to stop. It either can’t understand the question or has found 349 recipes that match.  Really disappointed,3.0
Excellent quality gave to Grandson for Christmas,5.0
It is a very good product and I used it for months but after an iPhone 6 being thrown at it it broke the screen. Another thing I dislike about it is the fact you can’t answer calls on it .you can answer them but it takes it straight to your phone,4.0
All will be fine unless you need to contact support. They're useless. Maybe 50 emails later I'm still waiting on getting my fitbit replaced. Probably better getting an Apple Watch in hindsight.,1.0
Excellent value.,5.0
Brilliant does exactly what it says on the tin 😁,4.0
fantastic love it and easy to use.,5.0
Accuracy  steps,4.0
V Good product,5.0
I brought this as a gift for my Dad! it is perfect to help with his daily steps!,5.0
Very pretty,5.0
"I bought this product , first the battery didn’t last longer then it wrote . Only two daysafter two week when ask for software upgrade, the display screen start doesn’t show , and very unclear .",1.0
Works great,4.0
Not accurate,1.0
"Bought this for my Husband for Christmas He love’s it Monitors his fitness, Heart rate and sleep very well. He also loved that he could go swimming while still wearing his Fitbit. Overall He is very happy with this watch and would recommend buying one.",4.0
I Love the cleanest of the dial I just love Fitbit,5.0
Love this watch I had a previous Fitbit but wanted one for swimming,5.0
I've been using the watch for 5-6 weeks. The battery dies in two days. I've never used it without charging for 4 days. The rose gold plating on aluminium parts started to be peeled off. You need to buy premium to be able to use lots of tools and apps.,4.0
Very nice,5.0
Nice item,5.0
I received my Fitbit versa 2 today and this is what was in the box! Absolutely raging that I have received an item that cost a lot of money but there is no Watch inside the box.  I have received half a strap and the charger!,1.0
good value,5.0
"It never worked, would not connect to wifi to get update ...returned",1.0
"Not only functional  but an attractive watch. Not used all the functions yet, but of those used they seem accurate and consistent.",5.0
"Is just not tracking your steps...if you going sleep, the day after you got at least 1000 steps more from no where..",1.0
Got for my son as a birthday present and he likes it.,5.0
i love this! so easy to set up and use and it keeps you motivated! i got 5 full days out of one charge and its been on and used constantly!,5.0
Please be aware if you have tattoos on your wrist then this is not for as it will not monitor your heartbeat which makes the watch useless had the older model Fitbit charge 2 had no problems very disappointed,1.0
"Was a gift for the mrs , she loves it",5.0
I love this watch. The only thing I have changed is the silicon strap as it's not that comfortable but the actual watch is fab. I like that all my notifications come through on it and that I can reply to text via Alexa.,5.0
Thank you,5.0
I love it,5.0
Nice.,5.0
Great,5.0
I have purchased through amazon and there is no way of communicating with the fact that after only 3 months the battery life has gone down to 24 hours. This is not acceptable. there is no facility to communicate with the seller????,1.0
"I upgraded to this model, only had it a few days, but I already love it. It's really easy to install, easy to put your own clock face on. Well chuffed!",5.0
Not compatible with Samsung A3 phone - does not work,4.0
Excellent,5.0
What you would expect from a smart watch,5.0
"My only issue with this is the material used for the strap. I’m so gutted, I love the Fitbit but my skin does not!",4.0
I'm very happy with it nn,5.0
Love fitbit,5.0
The sleep measurement does not work for me - don’t know why. Overall though very pleased with it. Bought to replace an existing Fitbit. The standard plastic strap did cause skin problems. Replaced with a metal mesh strap that has cured the problem.,5.0
Good sleep monitor battery lasts 3 days,5.0
"Love my fitbit and can actively keep track of my steps, heart rate and calories  burned. Makes more active in a daily basis.",5.0
It keeps crashing. It doesn’t work properly. Cant answer phone calls and the texts stop coming after a week. Very disappointed...,1.0
"Brought this for my partner, worked fine but then just stopped after 3 months so returned to amazon for a replacement, 3 months later yet again same thing, will be returning and requesting full refund and not buying fitbit again",1.0
Love the face so easy to read,5.0
My item is supposed to have a built in Alexa  and the Amazon Alexa tile is not even showing. Not sure what to do or how to fix this. I would like to speak to someone about this if possible,2.0
"Loved the watch, no fault of Amazon but had to send for a replacement after a month as it stopped syncing as it had no bluetooth. Hope the replacement lasts longer.",5.0
Good product for the price and does what was expected,4.0
Husband loves it,5.0
"Bought as an upgrade to my Blaze. Delighted, easier to charge and works with Alexa",5.0
10/10,5.0
I have owned several different Fitbit products and this is the best yet.,4.0
"This is a great tracker and much more eg weather,spotify Alexa",5.0
"A great product to track steps, calories and sleep. Only thing is the battery seems to go really quick but that is probably because I wear it 24/7 so battery is pretty great really! Definitely recommend buying this product!!!",5.0
It disconnects itself from the app. The exercise tracking doesn’t work majority of the time and even though my notifications are supposed to come through on it that is also inconsistent and barely works when it’s supposed to,1.0
"Great watch, lovely quality and design. Battery life doesn’t seem to be great or as made out. Also doesn’t send text messages to watch from app just phone calls.",4.0
Great watch has more than you need just waiting for a fitbit that has some more useful features for me. Easy to use and comfortable to wear,5.0
"Perfect for running and looking great, i really love the colour 👍",5.0
Love the upgrade.  Delivery was fast and packaging was protected. Easy set up and ready to use. Came with instructions which were helpful.  Came with small and large strap.,5.0
Does not sync well at all and dont get notifications properly disappointed.,3.0
Brilliant watch. It does everything I need it to do and more. Would recommend.,5.0
"Great gift for Christmas, my miss loves it!!",5.0
"Love the fact that it’s up to date to the exact second, it’s comfortable to wear and is very stylish",5.0
"I have had FitBits for the last 5 years and this one is by far my favourite!!I also feel it is a lot more accurate than others, the battery life is amazing and it is really clear to read and use.Would definitely recommend!!",5.0
Does exactly as it says on box.Great,5.0
"Bought this watch for my daughter and she's pleased with it but I'm not sure if its us, but the watch doesn't seem to work as it should. we will percivere a little longer but may have to send it back.",3.0
Had one before,5.0
Charging unit supplied will not sit flat on surface because of USB Cable entry to docking station.,5.0
Bought it has an xmas present for the missus,5.0
Bought for my daughter. She loves it.,5.0
"Not worth the money. Doesn't sync great with phone and only allows one form of communication to be registered (either text, WhatsApp or messanger) . Doesn't allow all 3. Shame as looks lovely.",1.0
I love my Fitbit! Best watch ever,5.0
Great for all the health info available to you ewspecially the sleep info,5.0
"I love this watch, it’s fabulous!!!Use it generally to monitor steps per day & sleep but there’s so many other really good functions!!!Easy to set up, easy to use!!!Wish I’d have bought one years ago",5.0
I'd like to try the Versa 3 as a comparison.,3.0
"The watch is not accurate to track sleep, steps and calories. Also it does not sync regularly I have to do manually when entering in the app. I had a lot of problems as well tracking correct distance when using bike.",3.0
"horrible, slow and very few apps available.",1.0
I have had a fitbit since 2017 & decided it was time for an upgrade. The versa looks good & does everything I need it to do. Comfortable & different from the usual black straps.,5.0
Perfect for my purpose,5.0
only lasted July till start April annoyed,2.0
"The Fitbit Versa 2 is well made, easy to use, and very informative. No problems to date and in fact provides more information than I imagined.",5.0
"Great way to keep track of steps/calories etc. 100% helped me be more active. Battery life is great, goes days without needing a charge, even when tracking walks and exercise. Fitbit app is super easy to use.100% recommend!",5.0
Battery lasts approx 9 days,5.0
"When i first got it to connect my Android phone, its was fine. But a couple weeks later it wouldn't sync and had to reboot my phone and FitBit to connect. Had to do that a few times. And had no other choice but to send it back.",2.0
Very happy with this item,5.0
