Reviews,Rating
"I really like my Fitbit Versa 2. I’ve owned Fitbit devices in the past and so found the interface easy to navigate around. It’s a fabulous way of monitoring your activity and encouraging yourself to exercise more. Plus the design is much neater than previous iterationsThe app really compliments the device. I must confess I don’t use it to it’s beat as I don’t track my fluid and food intake as I should.I do find on iPhones if I sync the phone to the device via the app just prior to trying to use GPS when running, walking etc it finds the GPS signal faster.Overall a very good device",5.0
"I bought this tracker in Sept after having had a good Fitbit experience previously. I should have read more reviews!! Watch worked OK at first although frequently didn't sync automatically and sleep/step trackers worked intermittently but not badly enough for me to return it. Then suddenly after only 2 mths just wouldn't turn on! Haven't done any strenuous exercise or ever immersed it in water. Thing was stuck on Fitbit logo. I rang Amazon and they suggested it was best to go via Fitbit so connected me. Spoke to a bloke who quite frankly seemed bored and irritated by me, put me on hold multiple times and for minutes only to come back with, ""Try putting it on the charger"" and ""try turning it on""!!!! Then ""OK we'll send a replacement"". I asked would it be a refurb he said they ""try"" to send out new watches! Of course what arrived today? A refurb! If I'd wanted a refurb I'd have bought one instead of paying full price only 2 MONTHS ago! Now I have something that has already been broken before and someone else has worn on their sweaty wrist! Gross! Especially considering the whole situation at present!!! Can't reiterate more - DON'T BOTHER! I'd have preferred they just fix my own watch. I don't have much confidence that this will last any longer than the first!",1.0
"Great watch, took me a while to set up all the different settings and still learning. Perfect for keeping a track of daily fitness, heart rate etc.Replying to txt msgs via the voice control is interesting doesn't always pick up what you say. To use spotify you need to have a premium account which I dont have, not paying extra for that feature. Really comfortable and looks good.",5.0
"Unfortunately this wasn't for me. It ran great as far as tracking goes but there are things you have to pay extra for which it didn't state when I purchased. My issue was the actual item causing some major skin problems. I woke up the day after first putting it on to extremely sore, red patches where the band had sat - I put this down to the silicone and sweating during the night so purchased additional breathable straps. Left the watch off until my new straps arrived and whilst my skin healed, finally put it back on and hours later under the watch interface unit was again red, sore and very itchy. After looking into it - This is a common issue with fitbit and fitbits only advice is 'Not to wear the device's.I've returned mine sadly for a refund",2.0
"My kids have been using and reving abot 'Fitbits' for quite some time now. Having recently retired from a job which involved lots of walking, I purchased the Versa 2, to enable and encorage me to continue to exercise. I wish that I had bought one ages ago. This product is so easy to set up, and  monitors steps, calories burnt, heart rate as well as having lots of other features. The Versa 2 even comes with Amazon Alexa included. Fitbit provide lots of support, and even award badges when targets are met. I cannot reccoment this product more highly. Everyone should have one.",5.0
"Microphone stopped working after a week..  the app always has to be in the background.  If I've been typing on my computer it says I've taken a hundred steps. There are a few extra useless apps on the watch.  All round rubbish.  Only good thing is that it tells the time. It stopped responding to touch half the time, and after half a day the battery runs out and  I cant do anything or send the watch back.",1.0
"Unfortunately I have to put 1 star for Fit bit. I had the versa 1. The screen suddenly went blank and I could not see anything. Then I upgreat to versa 2. I had it only 1 month, yes 1 month and yet the same problem. Blank screen. I got a replacement end of August, and today end of October surprise... blank screen again. 3 out of 3! And just to meantion, I do not go swiming with it, I do not wear it on the shower. I was looking after it so much. So diccapointed on a 150 pounds watch. I bought a dead cheap 15pounds for my husbant 5 years ago and he still has it in perffect working order.",1.0
"I recently bought this product on a sale price. I have been looking for a smart Watch for quite some time and when I saw this I couldn’t resist. From the moment I received the packaging in the post I could tell that the product was high quality. It was an extremely durable box with a nice and neat design at the front that was quite appealing. As I opened the package i could see the watch. The pebble felt strong and durable and the strap was a sturdy silicone style material which I found extremely comfortable to wear. It came with the charger and a second strap for larger hands. However I was disappointed to see that there was no specific instruction manual on how to use or set up the watch however after a quick charge (100% cant have taken longer than an hour) I set the watch up via the app. The watch can have various apps and clock faces added via the app and you can set up notifications and Fitbit pay (use your watch to pay) which is an amazing feature. The notifications of this watch are really good as they are similar to phones and easily accessible on the watch. Another feature is that you can answer calls from the watch.Overall, I believe that the Fitbit versa is a remarkable everyday watch which can be customised with various straps (if bought) and I would recommend it due to the high quality of the product.",5.0
I  loved being able to track my workouts. I thought it was a pretty great fitness tracker overall but I was very disappointed with the software issues that messed up with the heart rate monitor. The syncing was not always easy and the texts/calls would stop coming through for no reason - I didn't mind so much as my main use was as a fitness tracker but as a main feature of the tracker they should have been working. I gave up with the poor heart rate tracking and I am so thankful that Amazon provided great customer service in processing a return.,3.0
Brought a few of these as gifts a couple of mouths ago and the people I gave them to are really pleased with. They work well and seem accurate. With the ability to receive messages and notifications as well as the fitness features makes it a great all round smartwatch.,5.0
"Present bought as replacement for a successful first generation Versa, nice quality, arrived quickly. A little confusion over the changed interface and moving music is unnecessarily complex, but the recipient is a very happy bunny and has played with it incessantly since Christmas. A little trepidation over the replacement wrist straps as that tends to be the part which fails first, but will see how it goes. So far nearly a month down the road all is going swimmingly - which incidentally is something that it excels at monitoring swimming.",5.0
"love this. that's all there is to it. compared to the previous versa, this is a big step forward. the screen is so much crisper and nicer and the battery life is epic. the software is also much improved for better integration to android and of course with the fitbit smart scale. i have not used the alexa functionality yet, but the other features are all just that little bit better compared to the last generation of this watch.the build quality is also superb, it feels comfortable on the wrist and is nice and responsive and very intuitive with very little learning needed.excellent item.",5.0
"Great as a fitness tracker but other app's are not worth writing about. I brought this for my wife, luckily she only wanted a fitness tracker but I thought I would spend a bit more money as this could play music and had built in Alexa. Alexa isn't great it will only display text and is very limited to what questionsit will answer. The music app isn't much better either. I have a galaxy smartwatch which is so much better value for money and user friendly. If you want a fitness tracker go for a cheaper option and save your money or if you want the app's buy an actual smartwatch.",3.0
"This is utter rubbish, not accurate at all, sitting at my desk for 5 munites got me 250 steps, brushing my teeth got me 300, eating cereal got me 200, it's stupid by the end of the day it's saying you've done 78998000 steps, also if you want to connect the music apps like Spotify you need to have the £10 subscription or you can't use it, waste of money don't bother buying it",1.0
Brought this to upgrade original fitbit which I had no issues with the watch kept closing down and now does not work at all wrong time zone kept appearing not recording accurate states goid looking watch but very frustrating with so many issues awaiting replacement from fitbit thanks to Amazone support will give it one more bash but not holding out much hope will be asking for refund shouid not advice buying,1.0
"You are better off with the 20£ variant of the fitbit as its always synced to your phone, this on the other hand will only sync once you spend 30-40 mins resetting everything turning apps off and on trying multiple WiFi networks turn Bluetooth on and off and even then you have a 50% chance of it syncing, I have not managed to sync it in the last 4 days. It's not worth the effort. I've had it for just over a week and have synced it maybe 2-3 times with a lot of effort.Looking online you will find many more people having sync issues, and the usual text book answer is do a factory reset, which I've tried and it also doesn't work all the time and its not really a sustainable solution as you cant be expected to factory reset it every other day just so you can sync it",1.0
Bought for my wife for Christmas. Should have believed the bad reviews. Connected on first attempt. Since then has not stayed connected more than a few minutes. Won't log sleep and has now started to lose time. App won't connect to Wi-Fi. Even Fitbit web site is full of these problems but seems unwilling to help owners or resolve the problems. Am now returning to Amazon. Am really disappointed as it was a gift for my wife. Won't buy Fitbit again.,1.0
"ProsLooks niceStrap fits a small wrist of 5.5''Not feel fiddly when navigating.ConsOnly bank fitbit pay works with is Santander.Can only respond to text messages, WhatsApp (can do this by speaking to text)Can answer incoming phone calls BUT the microphone does not work with the watch so the conversation must be from phone.I purchased this item for the use of being able to call people if I had a fall. The fact I cannot even initiate a text let alone phone calls is a massive flaw. Also, the fact that you have to have a Santander bank card to even use fitbit pay is a big problem for me.Would not recommend this product for an extention to communicate with people.This is just a poormans glorified fitness watch.",1.0
"I have had several Fitbit in the past including Charge Hr & Blaze.I love my gadgets but I'm not a tech expert so this is a review from an every day user without huge expertise.Pros - display & screen look sleek. Stats are accurate & watch looks nice.Negatives - I have had to update software & this was a nightmare. I've had to restart phone, reset Fitbit several times. When I could see that upgrade was eventually kicking in, it too over 3 hours & an amount of stress. I haven't experienced this with my previous watches. Alex for me is pretty useless & as many other reviews have stated, I don't think the pay app will be supported in the UK.If I could go back and buy another model then I would have gone for Versa 1 or the Iconic.",3.0
I have been using this product for several months now. I like the fact that is easy to use and looks really nice. I had to buy a different watch strap as the original one gave me skin irritations. I have had other smart watches before and honestly for the price difference this Fitbit does not add much features. I love the fact that you can use it to pay contactless and the possibility to control Spotify is great and works perfectly. It is a pity that you must pay for other elements such as clock faces (some are still free). In general the app has a nice and intuitive design and it is very useful to add information such as food and water consumption. It also helps create a personal goal based on your activities. Some of the features are only available if you use an android phone. I would not recommend this if you are an Iphone owner. For example you cannot reply to the messages if you are using an Iphone. Maybe it is better to spend a little more for an apple watch in that case.,4.0
"This is my first negative review on Amazon.I don't know much about its features because I didn't use it myself.What I know is I bought it for my boss and it had a problem with a charger within three months.So, I sent it to repair with 1st class royal mail since 5 January, which I had to pay by myself for7.65 pounds.(They got it since 6 January.)What would customer expect from customer service of a brand that is more expensive than others?Yes, good customer service.However, it is not what I expect.I expect fast preparing for my boss.But I needed to ask for preparing progress three times and always got nothing.The first two times, I asked on Amazon chat.They told me to wait, 48 and 24 hrs.And I got nothing twice.Then I just knew that I could contact Fitbit directly.I contacted them since 25 January.They told me that they would check my case with their higher support team.And I got a tracking number in the next day (26 January).The case would be solved.However, that tracking number can't be tracked until now.It means I waste my time almost a month for this brand, for the item that is more than a thousand buck.I don't know what's next.But I'm sure on thing that I will never suggest this brand to anyone.",1.0
This is a great watch/tracker though my wife finds it doesn’t always count all her steps. Battery lasts about a week and all the built in features are really useful. I have one too and the silent vibrating alarm is good if like me you get up before your partner. There are many replacement straps available along with different faces to ring the changes.,5.0
"I had this watch for almost 3 months and the screen popped off in the shower hanging only by the cable inside. EXTREMELY disappointing as I was more than happy with the watch in every other way. But that's all irrelevant if I can't use it for longer than 2 and a bit months. This is baring in mind that I'm very careful with it, only work out occasionally but showered with it every day with the understanding that it was waterproof. This is my first and last watch from fitbit.",1.0
"I love this watch and tracker as I also love their app. I started training for a 5k run I have and this helps to track dostances, heart rates and times among other things. I also purchased a cover since I have my 2 little sons and 2 cats and I didn't want it to get scratches on it and thank God I did it.All in all this is perfect for me, not sure for advanced runners but it makes me happy and keeps me motivated and guess what? You can also use it to pay for your shopping! Absolutely amazing",5.0
"I love everything apart from the device...I’ll keep this short and to the point...I purchased this to monitor my workouts when cycling. It says that the watch must be 2 fingers above the wrist bone during workouts and this is the result of 2 weeks of having the device. As you can see it has seriously damaged my skin and I note I HAVE NO ALLERGIES WHATSOEVER. If the device is loosened it does not read heart rate correctly... so wear it right and loose the skin on your wrists or get false data, not good.The battery indicator is faulty and displays whatever the charge level it was at when removed from charge (e.g 75%, 98% or 100%) and stays showing that until it runs out of battery and died. Fitbit support told me that this was normal and it was my error... not sure how it is my fault that it dies at a battery level of 98%!Actual Fitbit software is amazing, this watch is a disgrace. I’ll be returning or exchanging for another model.",1.0
"So far so good! I decided to upgrade from my Fitbit Charge 2. The Versa 2 has more features and options than the Charge 2. It doesn’t feel bulky and is really comfortable to wear. I also like the fact you can swim in it, although I haven’t yet.I had been debating getting an Apple Watch, but decided I wouldn’t use a lot of the features, so the Versa 2 is just perfect for me.",5.0
"Best purchase I have made in a very long time.The Fitbit app is so user friendly with a lovely interface that’s not difficult to understand.The watch itself looks stylish and you forget that you even have it on.LOVE that my notifications go through to it.LOVE that it tracks my sleep.LOVE that it tracks my activity and fitness (I’m a total beginner and this has made me get moving again, such a difference!).LOVE that it has a built in alarm so I no longer have to wake my partner up with the horrendous iPhone alarm tune.LOVE that the battery life means it last for 4/5 days before a charge is needed!LOVE everything about it. Such a great little purchase!The only downside is, the screen of the watch is SO easily scratched. Without knowing mine has scratches all over now which is disappointing. I would recommend buying a cover before wearing properly.",5.0
Reliable (and good-looking) gadget - I used to use a small Fitbit tracker but now wanted something with a bigger display that can handle more than just tracking and this is perfect,5.0
Bought this for my wife for Xmas.  As she already has had many different fitbit watches . She tells me this is the best of them all. Both from the information presentation and the viewing of the information in sun light conditions. Appears to give her accurate information as she is always doing comparisons with apps loaded on her phone. If she is happy then it must be good.,5.0
"My new Versa 2 Fitbit. I received delivery on 27.11.20 it was fully charged.  When my battery was getting low I put it on the charger.  After a few hours I checked my Versa 2 only to find it was not charged and the battery was almost flat.  I contacted Fitbit who gave me suggestions on what to do to sort the problem but none of them worked. By this time the battery was flat.  I was about to return the Fitbit to Amazon but thought I’d try the old charger, it fit more snugly into my old charger than the new one so you can assume from that that there was no connection.  Within seconds my Fitbit started charging. In the instructions that came with it, it states you should not use an old charger, if I hadn’t I would not have known the new charger was not fit for purpose.",5.0
"Love my new versa 2, I didn’t want to go for the 3 or the sense as to be honest I’ve been contemplating upgrading to Apple Watch later in the year.I was worried it would look too big on me, but I needn’t have.I’ve always had fitbits since they started, only sorry I bought a charge 3 last time instead of the versa 2! But the versa 2 is making me question the ‘desire’ of the Apple Watch!I love the sleep tracking,  but steps and heart rate are the most important feature for me.Super duper easy to set up, although I haven’t connected my Spotify or AirPods yet.  Nor have I tried the spo2 feature, (but I guess I’m not bothered to as don’t understand it, and I’m fit and healthy anyway)Heart rate seems accurate, I’ve taken my pulse and then checked the Fitbit and they are very close.Great battery life, I’ve got it on screen always on mode so it eats up battery quicker but I don’t mind.",5.0
Ok so review time. I have had the fitbit for just over a week now and i can verify its the real deal ( not a knock off. It comes with 2 straps small is already on it then it comes with a large that you can change over to ( if you have a bigger wrist.) you can change the background as you can see mine is stitch and its overall a really good size and a nice product. I also got a screen protector because the screen is glass just to warn you.Ok now down to downsides. For starters i got the fitbit because i knew it had like a kinda apple pay thing but its really restricted with cards which is frustrating so that means i cant pay with mine ( hoping that add my card soon haha) secondly tue charger it comes with is a good charger but the cable will bend and break so this is my only warning. Other then that the product is great and really useful and pleasing to the eye.,5.0
Loved it. At first. It appeared to be fantastic. But today the watch has burnt my skin so now I don't want to wear it. It wasn't an irritation from the strap. I actually felt it burn and immediately took it off to find a sore red burn mark on my wrist where the back of the watch sits. Very disheartening as I really did love this watch.,2.0
"Bought as I lost my pervious watch, when I read about it was really excited about being able to download songs to the watch, but wish I had read all reviews 1st as like the others said you need a laptop/computer which I dont have as like nearly everyone I use my phone/tablet.Can't believe that a company as big as fitbit hasn't sorted this yet :(Still a good fitbit would be fantastic if I could get songs on it.",4.0
"It is absolutely crap. I brought a £20 one in January which looks the same and works much better and does more, the only plus was this watch had spinning on it and the maths on that is wrong, I worked hard, i was pouring with sweat for 30 minutes and it said 94 calories burned whereas my other app said over 300. If you think paying an extra 100+ for it will make it a better watch then like me you will be very disappointed. It doesn't even count the steps correctly. You have to pay £8 a month for it to track your sleep etc whereas my £20 watch does it for free and my much cheaper watch does the blood pressure and blood oxygen. The fitbit is a rip off. Don't waste your money on it like I did.",1.0
My favourite fitbit design so far. I much prefer the larger clock face compared to other fitbit like the Charge as it's much easier to see the time and my steps. Maybe it's just me but the Spotify link seems a bit redundant and Alexa will only work when my Fitbit has access to WiFi so they're not great for when you're out and about. Still I love the amazon exclusive purple and rose gold combo and I have found the app finds and syncs with this fitbit much easier than the old ones.,5.0
For the sole reason that you cannot connect to spotify & change tracks whilst doing a workout. Yes I can download music to the phone but that's a head ache.The spotify thing is heavily marketed for this phone. Very disappointing not to see multi-tasking when doing a workout.,3.0
"For the price, I was hoping for more to be honest.Took a long time to figure out syncing, and even then, it wouldn't half the time. Only had it for about 24 hours before deciding to return for a refund. Amazon handled brilliantly though.Maybe I didn't give it a fair trial, but i was massively underwhelmed for the price I paid. Couldn't get it to use the Spotify app, which was a big thing for me. Would rarely sync notifications either, another big deal for me.If you're thinking of getting one of these, I'd probably recommend saving yourself a few quid and going for the original versa or lite. Almost identical functionality and less damage to your wallet/purse!",2.0
"This is my first Fitbit and god am I pleased I chose it! Easy to install, set up and sync with my phone app- really clear instructions and tonnes our helpful tips to get you understand I how it works. Comfortable strap with spare included should you need a larger wristband. Wonderful strong colour and quality finish with face displaying crystal clear graphic. Would recommend buying a protective cover for it.",5.0
I have had this now for just over a month after it had been delivered to my parents in Scotland as I was supposed to be visiting and collecting. I had noticed that the battery was not as good as my 2  yeard Charge 2. I fully charged it yesterday and put it on around 5.00pm. Today I got the text at 4pm to say my battery was low! that is just disgraceful. I should not be charging a brand new fitbit every day. Not sure what to do with it...,2.0
I bought this for my daughter as she loves it. It’s the second one she’s had the first being an older model. It’s obviously a good watch and she loves it otherwise she would not of wanted the same type of watch. So from what she’s said it is highly recommend. The only negative issue was the plastic strap it came with irritated her wrist where water would sit under it after she’d had a wash or had her hands in water so we bought the metal strap and that has been better,5.0
"Very limited smart watch. It is not a good value for money. Better if you get a Galaxy Activity, miles better.The tracking system is questionable as it isn't GPS based.The app is limited as well, many issues with synchronization and Bluetooth connectivity. The music apps are reduced and only works with premium Spotify.The touch screen response is not good, sometimes it is unresponsive and frustrating to going to settings as it keeps going to home screen.",3.0
