Reviews,Rating
"I got this for my birthday and I have been using about a month now.  This is my first Fitbit so I can't really compare to the other models but as an individual product it is great.I bought it to encourage me to walk more and have been using it for my couch 2 5k runs, I find it seems fairly accurate and the automatic workout sensor is very cool although it did get it wrong one time and thought I was on the eliptical when I was actually running lol! but every other time it has been correct in sensing whether I am running or walking.The sleep function is very cool and seems to be accurate, I find it interesting to check each morning!The app is great although at times I can have trouble SYNCing it to my watch, it always resolves after I turn off bluetooth and reconnect but can get a bit annoying.  The app is great though, you can find more in depth information about your sleep cycles, your steps, distance you've walked, your workouts and more, you can track your period and symptoms and it will predict when you are next due on, you can also track your birth conrol pills etc.  I you wish you can track your calories and the food you've eaten or the water you have dank.  There is a community section and you can add your friends to motivate and support each other which is very nice.  There are many apps to choose from, there are apps for kegel exercises, for meditation/mindfulness, for toothbrushing etc.There is a premium function but I have not bought it, through this you have access to workouts etc but for me personally I wasn't willing to pay for it from the reviews I read it seemed overpriced.  Another thing I have read is aparently the tend to break if you use them in water so be careful of that..I personally take it off to shower etc as to me it's not worth the risk.  I like to use spotify through my watch when running/walking as it makes it so much easier to skip through songs rather than pulling my whole phone out!Overall I am very happy with the watch, it looks great, I got the pink colour and I love it! It looks smart and goes with every outfit and it doubles up as a nice accessory as well as being functional.  It definitely motivates me to keep active and I love all the additional apps and functions, I would recommend it!",5.0
I upgraded my Fitbit HR to this version. Easy to install and a lot more advanced than my last one. More features and clear screen. Very happy with this buy.,5.0
"As a gym person I quite like it! It's not as smart as Apple watch but it's smart enough to help you deal with few things while on the go. Great synch with fitness Pal, no problem with iPhone synch so far. Battery is a winner I got it yesterday afternoon with 60% battery with a set up, full use of the features as I was playing around it has 55% today! I can't be more happy:) great sleep tracking, water intake, women health:) if you have a Revolut card great synch with contactless payments:)Events from Apple calendar pop up on the screen too! Sleek look and very very soft strap-super comfy even when sleeping:)So far so good!",5.0
Most of the features are useless.Cannot use to pay with contactless as only A couple of banks in UK are included.Cannot use for music as it won’t connect toDeezer even though I had to pay for a Deezer account and paired it.  I do not use iTunes so that app is useless.Could not get Alexa to work.Doesn’t show details of sleep quality unless you pay for the Premium account and I feel it’s a cheek to have to pay an extra subscription to use when the watch itself is expensive.Pros: Alarm is good and wakes up with vibration.I like the Relaxation app.Variety of watch faces to choose from.But overall unimpressed as this really is just an expensive watch with a step counter.  Now going to return it and stick with my cheaper step counter which has better features for a fraction of the price.,2.0
"I love my new watch. I have had a few Fitbits before but changed to a Samsung tracker for better integration with my phone. One thing I noticed very quickly, though, was that it wasn't tracking steps very accurately. This tracks every single step I take. If I walk 100 steps it counts 100 steps, whether I'm holding a bag (or motorbike helmet) or have my hands in my pockets. These were two things that seem to confuse the Samsung watch. The only bad point is that Fitbit seems to give me a few hundred extra steps a day when I ride the motorbike. The heart rate always seems a little high too, otherwise the watch is accurate.The app sometimes seems to struggle to sync with the watch, occasionally causing problems with passing notifications from the phone to the watch. The app needs a general update and ""sort out"" overall in my opinion. The food tracking is brilliant, with a HUGE catalogue of foods available to enter with just a barcode. If we were allowed to enter our own foods with a barcode (for the odd missing item) it would be a lot better still. Samsung's app and phone connection is 100 times better. Samsung also offer LOTS of free excercise plans and fitness tips, Fitbit have chosen to make these features ""Premium"" which is the very worst thing about Fitbit in general. This is the only way that Samsung is better than Fitbit.The watch looks lovely. I really love looking at it and it feels very comfortable 24 hours a day. The finish seems of a very high quality. This one of the reasons I chose this over other Fitbit models.The watch functions well as a fitness tracker, watch and calendar. The touch screen looks great and feels great to use. This watch motivates me to keep moving all day, helping me get fitter and lose a little weight.Overall this is the best watch I've ever owned and it is an absolute bargain.Update, 4 months with the watch I have lost 2 stone. Most importantly I have lost a lot of body fat and gained muscle. This was down to tracking the food on the app and keeping below the calories I had burned. I wasn't fat and haven't worked hard for this but having everything in one app has helped me realise what I was doing badly!",5.0
"Upgraded from son’s old Blaze (he went Apple) Always been a fan of the sleep tracking on Fitbit, which is the same as the old Blaze, due to the fact it uses the same App on your smart phone. The exception is battery life it’s simply excellent, without using the always on face, I’m getting about 5 days of charge, compared to Blaze which needed charging every morning whilst showering. (My sons Apple Watch S3 is on charge every night....Hah!) haven’t checked out all the apps yet, but really loving the sleeker design, the fact I can wear in the pool or shower, don’t need to remember press the ‘water proofing’ button as you do on Apple S3 Watch, just wear it like it’s a watch! The mobile app is clear, there aren’t as many apps as on a Apple to download- but that means it’s simple to use, easy to get the hang of, and quite frankly EXTREMELY GOOD VALUE at its price point.  If you’re not a die hard Apple fan and value the pennies in your pocket, the Versa 2 is your perfect fitness tracker!",5.0
Hi I had to return this item as it wouldn't download to my phone and still waiting for a refund,1.0
"I bought it during lockdown to encourage me to move more. I really wanted to like it - not only as the red gold and purple design appealed to me - but I'm utterly underwhelmed to say it politely!First of all it comes without any instruction manual at all and is very difficult to set up if you haven't owned one before. The screen is much smaller as expected from pictures and the black frame around display makes it even smaller which makes small writing difficult to read. Not very accurate either as I compared with GPS from my phone. This device is also more suitable for American Market as most of the apps are not supported in the UK, so useless! On top of an already expensive watch you have to pay nearly £10 per months to access premium services which puts me off most. You can buy a new smartwatch for the money you spend on premium services paid for a year!Watch itself is made from cheap plastic and charger style is fiddly if you want to use bumper case for screen protection as you have to remove it every time you want to charge it. Battery life is poor too (about 2 to 3 days) and I didn't even use always on display!Only pros for me:- nice clear Amoled display- fairly accurate sleep tracker- I liked the square screen design, just too small for me- it comes with 2 straps to fit every wrist and straps didn't irritated my sensitive skin- nice colour scheme - red gold with purple strap- lightweight as made from plasticTo sum it up: I don't understand the hype about fitbit products at all and returned it after a week for full refund.They are just cheaply made, overpriced basic pedometers for brand snobs and certainly not worth the money! You just pay for the brand and not quality which makes it very bad value for money! In fact my first experience with fitbit was so bad that I would not even try another product of this brand.I bought a Huawei GT2e (new model) instead for less than £100 while on offer which is superior to the fitbit versa 2! Bigger Amoled display in metal case, not plastic! Integrated GPS and all services are free incl a large range of watch faces. Not to mention a battery life of about 10 days! This is what I call quality and value for money! And even my gadget loving husband was so impressed that he ordered one for himself today, although he said he didn't want or need one! This says it all, lol.",1.0
"Great product let down by some slightly iffy syncing from time to time. Good battery life and good tracking as long as you don't expect miracles.  Good notifications from watts app etc.  Don't' really know why you would waste your money on an iWatch etc when you can get this. It would be nice if they did some work on the phone app though so you could more detailed heart rate tracking, for instance I have sleep apnea so being able to see minute by minute heart rate during the night would be useful but as it is you just see the whole day as a graph.",4.0
"Bought this in August 2019, it had been great. I connected it to Strava and used it to track my runs. Then last year I started cycling so I've been using it for that and tracking my steps aswell. That's all I wanted it for, not interested in sleep tracking or anything else really... Just tracking and keeping an eye on how many miles I've done during a ride and also my heart rate. The watch looks great and I'm still using the original strap and there's no scratches on it despite bashing it a few times. The battery still lasts 3 days too, even after using it for workouts.Issues -In the past month I've started to encounter problems with the device and it's been really unreliable. It wouldn't connect to Bluetooth, kept saying pairing rejected, and it kept losing my GPS signal which is a pain, and not syncing. I did a 16 mile bike ride today and it only tracked 3 miles of it. This is after following all the problem solving steps on the Fitbit website and speaking with customer service and spending 4 hours messing with it and eventually doing a factory reset. I thought that had solved the issues but it is just too unreliable for me now. I'm going to sell it and try the Versa 3 in hope that it will work but I'm also not too convinced that it won't fail at some point in future. It's a shame as I like Fitbit and the style of watch and interface but if I experience issues again then I won't be buying a Fitbit device in future.",3.0
"Firstly I do really like the look of the watch.  It does resemble an apple watch in many ways and I really cant fault the build quality.  The rose gold metal looks classy and the whole thing feels like a quality bit of kit that I was happy to wear.I'd upgraded from a much cheaper Huawei band, expecting a huge improvement, but other than a few unnecessary bells and whistles, I'm not sure I got it.Firstly, the display.  Brilliant to have a wide choice of downloadable faces.  However using the always on display drains the battery in just over a day. Not using always on is an option, but unlike previous bands, this seems to need a button press to view, rather than turning the wrist.  A small, but annoying point.Alexa built in is also unnecessary and seems quite gimmicky.Was excited to be able to control Spotify from the watch, but the reaction time on this is slow and frustrating.Step counting seems fairly accurate.  However I was disappointed to find that the watch has no in built GPS (unlike my far cheaper Huawei) and relies on connecting to your phone GPS, so no maps of running/walking routes available post workout.The last straw for me has been that after a few weeks of use, it seems to be struggling to maintain connection/sync with my phone.  Reluctantly I'm sending it back and will stick to the Huawei!",2.0
"Buyer beware:1. This Fitbit does not fully support the Windows 10 Fitbit app.  Android and IOS are supported, but will often tell you to connect the device to ""your computer"" to performa certain tasks.2. There is no obvious way to transfer your own music to the device storage, although this is a key selling point.3. No native Spotify.  The Spotify app only allows you to control playback from a phone--undermining the ""leave the phone at home"" selling point4.  Deezer is supported offline but ineptly:  the app only shows a subset of your Deezer playlists, and if the one you want to run with is not showing the only way to access it it to delete other playlists until it appears.5. Connectivity and synching are fiddly and uncertain:  some functions only work while charging--but the error messages do not inform the user of the need to connect the device to the charging cradle.6.  No Google Assistant: although Spotify is now owned by Google, the phone only offers Alexa.7. Online help ""community"" will sometimes offer user-generated workarounds, the official response is either to misunderstand the question, ignore it altogether...or shrug.This appears--on paper-- to be a superb piece of hardware. But it desperately needs a complete revamp of the firmware and mobile and desktop apps. If Google are serious about this acquisition they need to seriously look at the programming talent involved in the project.",1.0
"I was always a Fitbit fan,  having bought half a dozen devices over the years, but Fitbit has now completely devalued the entire product range by replacing the excellent summary of the actual time spent asleep with the risible ""sleep score"".  Don't be fooled, this change is a cynical and greedy ploy by Fitbit to get people to upgrade to the premium service which involves paying a monthly subscription fee for something that used to be free. There are many complaints about this change on the Internet and for me this is a complete stopper to using Fitbit going forward.  I'm now waiting for Apple to build in a decent sleep app at which point I will jump ship to the Apple watch.",1.0
"I got this as a gift.It stopped working after 1 week of use. Really disappointed with the product, but the worst part was amazon's customer service - I was offered a repair (for a watch that I've paid nearly 200 pounds). When ai requested a new watch I was told to contact Fitbit by myself and was sent contact form for fitbit.I've bought the watch fr amazon, so I am expecting to have a solution from amazon, not having 5o contact fitbit by myself.Shocking.",1.0
"Well, I tested the  Apple serie 5 Watch for a week (returned!)  just before purchasing this one. In terms of technical promises they are pretty similar this one is even better because it has the sleep tracking.Few different things though that makes Apple a bit more in advance than others is the look.1 - In terms of esthetics this watch is not good at all, so men will like it :(  the full screen is not covered when showing the time, there is a black sort of square around that disturbs me a lot. Only If you buy third party sellers some background watches for Fitbit, maybe you will be lucky to have a full screen covered.2- the main button is on the left side. VERY ANNOYING especially If you wear the watch on the left wrist. The button should have been on the right side (more practical) Apple Watch lets you do that by changing your wrist bands if necessary (an other point for them but their price is crazy high)3- The app is confusing. the user is mostly lost at the beginning and can't start a workout without knowing the watch well before hand! :(4- finally price is still a bit high even though it's half price of an Apple Watch there are many more watches on the market under 50 £ offering same features5- Alexa on my testing watch was not talking, there is no speaker on the phone, it just writes the info, I always need glasses to read, very annoying.",2.0
"I've been a long-standing Pebble Time wearer, but wanted something a bit more up-to-date, and was interested in having heart rate measurement. Battery life is great - easily 5 days with constant use, and only an hour or two to charge back up. I need to have to my phone on me anyway during walks/runs etc. so the Connected GPS is fine for me. The app is packed full of information, although I will say the interface is a bit confusing - just try tapping on everything and there's often more data hidden behind. I'm finding the calorie budget and food logging functionality really useful and have lost a couple of pounds after only a couple of weeks. The heart rate and sleep tracking has proved more interesting than I was expecting. Screen visibility is fine indoors, outdoors. It's a bit plasticky to be honest, but I'm not really worried about the looks anyway. Notifications work well, and give you ability to clear them from the watch, and for some apps delete, open on phone etc. (I'm on Android). There are lots of guided workouts and things from the phone app that I haven't tried yet, but my free trial of Fitbit Premium hasn't convinced me it's worth £9.99 a month yet. Connectivity has been absolutely fine on a Pixel 3a (Android 10). Love the single button on the left side of the watch (I'm right-handed) - simplifies interface, and means it doesn't get accidentally pressed during press-ups, handstands etc. It's not a computing powerhouse like the Galaxy Watch Active or Fossil Wear watches in terms of app choice etc. but I personally don't want to play around with apps on a tiny screen, and not having to charge every day is the absolute clincher for me - I just don't want to find myself away from home unexpectedly for example, with a dead watch because I didn't charge it yesterday. In terms of accuracy, it definitely has a tendency to record movements incorrecly as steps - I'm a drummer, and have to take it off if I'm practicing/playing otherwise I add thousands of extra steps! However, overallI'm very impressed.",5.0
Positives:It is very stylish looking with an extra strap.It has lots of good features including sleep score.The charge lasts quite a while.There is challenges to keep you motivated and mindfullness programs which are great with the covid19 situation.The price is reasonable.Notifies me of messages and emails and allows me to send short responses from the watch.Mobile app is easy to use.Negatives:The accuracy is not great. It doesnt count me going up flights of stairs in my home.It does not have an oximeter.The clock faces have to be purchased with money.Certain apps need premium membership.It doesnt always read heart rate if you have arm/wrist tattoos.Overall its a good watch though. Happy with it and everything it does. Of course there are negatives but the price is reasonable.,5.0
"Everything about the watch is spot on (accurate sleep tracking, app notifications, calls, exercise reminders) except for the steps counter! I’m not sure how much it over estimates my steps (maybe by 50% or more); it is super sensitive that even when driving fitbit counts the wrist movement as steps. Also going to the toilet at night records a whopping 60 steps when it’s probably just 20 steps back and forth to my room. 😅I have a relatively small wrist so I got worried when I bought versa 2 but upon wearing it, I realised it isn’t as big as it looks like. I got this as a present to my sister and seeing how it works made me buy one for myself as well. I like how they have different colours to choose from. The straps are easy to remove so you can change them whenever you want. ❤️😊",4.0
"The Fitbit Versa 2 is a great watch for anyone wanting to get their fitness to the next level. The watch is big but it still looks great on a tiny wrist and is comfortable to wear. It is waterproof (had an accident on day 1!) but it is not what I would call burgundy! If like me you think burgundy as more of a red shade, this watch in burgundy colour is purple! Still beautiful but the image colour is accurate, it's more purple than red. But that is really the only bad thing I have to say about this!The measurements are likely not highly accurate but that is true for any smart watch, take the numbers as general trends not exact! Very happy with it and nice to see that Fitbit made app improvements.",5.0
"Looks great, comfy to wear, very reasonably priced. As a basic watch it functions well. If you turn the always on display off its last just over a week but with always on its about 2 days. The always on display is poor, you cant see it a lot of the time and its different to the clock faces you choose. The sleep track is excellent that’s i purchased the Versa 2. The other functions like heart rate are shocking. Doing a HITT workout Where my heart heart was near its max my heart rate on the Versa is showing around 130 lol. If you want a basic smart watch with is excellent for sleep tracking and has good battery life this is your watch. I also order the charge 4 but sent it back. Again with the charge 4 the heart rate is a joke. I found the Versa 2 more comfy to wear and think the charge 4 looks like a kids watch. Both very similar but the charge 4 is fiddly to use where the Versa 2 is easy.",4.0
"I love Fitbits as they always encourage me to get up and drink more water, to get better quality sleep and to eat healthier. Having a constant reminder on your wrist is the perfect way to stay active.Charges really quickly and holds its charge for about four or five days depending on how much you use it.I love that it's water proof - I rinse mine off every time I have a shower as dead skin tends to rub off into it when wearing all the time. Very easy to clean and comfortable to wear.Love this colour the most!!Sleep monitoring skill is very interesting and some of the new clock faces are really inventive. I have steps as my main goal because once I've accomplished that I tend to have already completed the others in the process!Had some trouble updating it at first but I spoke to someone on webchat and it was sorted very quickly - great customer service.Anyway, I love it and I highly recommend.",5.0
"It is beautiful, I bought it on sale and for the price it is what I wanted. A digital watch that does other things besides tell the time.It is great for walking, running, hiking and only a little bit off counting steps. It is a bit useless for biking as it can't tell you the distance but it will tell you calories, heart rate and even the speed of your bike ride. The distance travelled will not be logged correctly though and it can't be edited afterwards. I have looked for fixes on forums and this problem has been brought up at least a year ago and it is not fixed. I do a daily trip of 7km but it only logs 1.3km on average. Some people have mentioned that it will even show their route on the map but the total value isn't correctly logged.It loses pairing very often as well. I'm not sure why... but I simply add a new versa 2 when it stops sync. So I've added my versa about once every 2 weeks. It is a bit of a pain but no data is lost by simply replacing it on the app. It is a gorgeous piece but adding new faces to it can be a long boring process...Overall I would buy it again probably as the competition isn't priced as well and the watches aren't as pretty.If you want a smartwatch for more casual purposes like logging your workouts, tracking your sleep, having an idea of your daily steps (it comes with several features that I don't use but you might want like food log, water intake, weight tracking) then I would recomment it for you.It is very customizable, you can change the amount of calories you wish to reach daily, the amount of steps, hours of sleep, etc. It is all done through the app or dashboard (on the website).",4.0
"My partner and I have used FitBit for years and love the step tracking, sleep tracking and the layout etc of the App. However after the disappointment of this product my partner has now switched to Garmin.The Versa 2 is a very nice looking watch but please keep your eyes open read the specs carefully and all the reviews.Liked:Nice design, Interchangeable straps, bright clear straps.Disliked:Alexa functionality was a key advertising tool, applications are very minimal, and actually was never used.Spotify account kept logging you out constantly, known issue with no resolution. Plus requires premium membership.Pay functionality is extremely limited and very few banks available.Screen glass is not robust, you must buy a screen protector.",2.0
